,col1,col2,col3
40,因国内矛盾被美大使警告后 以色列怒怼：少管闲事,原标题：因国内矛盾被美大使警告后，以色列怒怼：“是你要踩刹车，少管闲事”！[环球时报驻埃及特派记者 黄培昭]即便压力重重，以色列议会21日仍正式通过全面司法改革计划中第一项法案的一读。为此，耶路撒冷和特拉维夫爆发大规模示威活动。美国方面对此提出警告，但遭到以色列回怼，称其“多管闲事”。据以色列《耶路撒冷邮报》21日报道，此次关于司法改革的讨论异常艰难——全体会议从20日下午 4时开始，一直持续到深夜，直到21日中午才结束。最终，议会以63票对47票通过一读。反对派领导人拉皮德在推特上怒斥内塔尼亚胡：“法案损害民主，损害经济，损害安全，可以肯定的是，你正在撕裂以色列人民，但你根本不在乎。”21日，以色列议会大楼外，数以万计的民众聚集抗议内塔尼亚胡领导的极右翼政府推动司法改革。他们认为，如果改革计划获通过，以色列的“司法制度将被政治化，民主也会受到破坏”。以色列政府则强调，司法改革将恢复政府部门之间的平衡，阻止司法过度扩张。以色列警方说，在集会上，有数十人因扰乱秩序被捕。以色列总统赫尔佐格再次呼吁通过谈判政治解决分歧，他21日强调说，现在仍有谈判的空间和时间，谈判化解分歧是最好的方法。根据政府的司法改革计划，议会将更容易推翻最高法院的裁决，并增加政府在挑选法官等方面的话语权和影响力。以色列的司法改革还引发了美国的关注。据英国路透社20日报道，美国驻以色列大使托马斯·奈德斯19日称：“我们告诉（以色列）总理，踩下刹车，放慢速度，努力达成共识，让各方团结起来。”美国大使的表态显然引起了以色列当局的不满。以色列财政部长比撒列·斯莫特里赫19日说，“我们一直确保不干涉美国内政，所以我希望美国不要干涉我们的内政”。以色列侨民事务部长阿米凯·齐克里则回应称，“我告诉美国大使，你要踩刹车，少管闲事”。司法改革案一读通过后，将交由议会宪法委员会进一步讨论，然后再交回议会进行两轮投票，即二读和三读，才能通过。以色列《国土报》21日分析说，由于政府在议会中占有半数以上席位，不出意外，法案最终将会通过。,军事
41,瑞典学者：破坏“北溪”管道是美国开展的“经济战”,原标题：瑞典学者：破坏“北溪”管道是美国开展的“经济战”针对美国知名记者西摩·赫什近日关于美国破坏“北溪”管道的爆料，瑞典跨国和平与未来研究基金会智库创始人奥贝里在接受中央广播电视总台记者采访时表示，他支持赫什的结论，认为美国和北约策划破坏“北溪”管道，此举是美国对其欧洲盟友展开的“经济战”。奥贝里指出，从技术上看，只有少数国家拥有潜至深水处放置炸药并远程引爆的技术；而从利害关系上分析，摧毁北溪管道、切断欧洲与俄罗斯关系的受益者也是美国。综合这两点，炸毁“北溪”管道就是美国所为，这是一种针对欧洲的“经济恐怖主义”。瑞典跨国和平与未来研究基金会创始人 奥贝里：这不是任何国家都能做到的，这当然是美国干的。他们摧毁“北溪”管道能获利。首先，这么做能切断与俄罗斯的联系，这是他们政策的一部分。其次，美国现在可以向欧洲出售天然气，据我所知，售价比本土高出3到4倍，所以美国欺骗并剥削了他的欧洲“朋友”，这是一种“经济恐怖主义”，这是针对朋友和盟友的“经济战”，对欧洲来说是一种破坏性的自我毁灭。面对赫什的爆料，西方媒体选择了沉默。奥贝里指出，对西方媒体的操纵也是美国“经济战”的一部分，美国利用媒体来煽动战争、引导舆论。在本应该调查事件的时候却针对赫什进行大量的批评和抹黑，这再次证实了美国炸毁“北溪”的行为。瑞典跨国和平与未来研究基金会创始人 奥贝里：西方媒体对此保持了惊人的沉默，如果被证明这是俄罗斯或中国或伊朗或其他国家所为，那么在西方主流媒体上可能会有持续数天甚至数月的大肆报道，讨论制裁以及如何惩罚等等。而事实上，现在媒体针对西摩·赫什进行了大量的批评、质疑、污蔑和抹黑，在我看来，这似乎再次证实了这是美国所为。,军事
42,美国火车脱轨事故现场挖掘出大量受污染土壤和水,原标题：美国“毒火车”脱轨事故现场挖掘出大量受污染土壤和水当地时间20日，美国福克斯新闻网报道称，目前已在美国俄亥俄州东巴勒斯坦城列车脱轨致有毒气体扩散事故现场挖掘出大量被污染的土壤和水。涉事列车运营商美国诺福克南方铁路公司20日表示，事故现场已经挖掘出约6.8吨受污染的土壤以及约416万升被污染的水。该公司称，11节运载危险品的脱轨车厢中，大部分已被净化，但在美国国家运输安全委员会完成调查之前，它们仍将留在现场。事故发生后，当地居民担心有毒物质造成的环境污染会危害身体健康，且不少人已经出现恶心、头痛、皮肤过敏等不适症状。而美国政府部门发布的多项自相矛盾的信息，更让当地民众心存疑虑，对政府的不信任感日渐加深。比如，当地政府官员发表声明称市政供水可以安全饮用，但同时又建议居民购买瓶装水饮用。美国环境保护署此前声明称未在居民家中检测到空气污染，但进行分析研究的机构却是由诺福克南方铁路公司聘请的，因此许多居民对空气检测结果是否准确持怀疑态度。当地居民：我女儿患有哮喘，她一直咳嗽，我儿子也一直咳嗽。我儿子的房间在地下室，但地下室的空气质量却被检测出是整栋房子里最好的。这怎么可能呢？有人对检测仪器进行校准和检查吗？这些行为都是作秀而已，而这本该是有科学依据的。当地居民：我们就像是实验室的小白鼠。5年，10年以后可能会患上癌症，也可能不会。当地居民：我清楚这样非常不好，我知道他们在对我撒谎，在欺骗所有民众。,军事
43,拜登再发声：感谢波兰“坚定不移”支持乌克兰,原标题：拜登再发声：感谢波兰“坚定不移”支持乌克兰据美国有线电视新闻网（CNN）报道，当地时间21日，美国总统拜登与波兰总统杜达在华沙会面。拜登称，感谢波兰“坚定不移”地支持乌克兰。资料图 新华社供图据报道，拜登当天表示，乌克兰危机爆发后，波兰对乌克兰的支持“非常出色”。他对波兰收容超过100万乌克兰难民，表示了感谢。拜登还称，乌克兰处于“比以往任何时候都更好的位置”，并呼吁北约国家“保持头脑清醒”。拜登说，“我明确表示美国对乌克兰的承诺是真实的，一年后北约将比以往任何时候都更强大……我们必须面对很多挑战，相信我们可以一起做到。”此外，拜登还说，“波兰人和美国人之间的联系非常牢固和深刻。”拜登还和杜达开玩笑地说，他从小就“意识到”自己不像许多邻居一样，拥有一个听起来像波兰人的名字。,军事
44,土耳其强震已造成该国42310人死亡,原标题：土耳其强震已造成该国42310人死亡当地时间2月21日，土耳其灾害与应急管理局发布消息称，土耳其强震已造成该国42310人死亡。,军事
45,普京暂停参与《新削减战略武器条约》 布林肯回应,原标题：美媒：普京称俄暂停参与《新削减战略武器条约》，布林肯立即回应据美国《纽约时报》21日报道，正在希腊进行访问的美国国务卿布林肯对随行记者称，俄罗斯宣布暂停参与《新削减战略武器条约》是“非常令人遗憾且不负责任的”行为。美国有线电视新闻网称，这是布林肯2月21日在希腊与记者交流的画面。报道称，布林肯称，美国“准备随时与俄罗斯讨论限制战略武器的问题，无论世界上或我们的关系发生了什么”。他还称，美国将“仔细观察俄罗斯的实际行动”，拜登政府也将确保美国“为自己国家和盟友的安全采取适当立场”。《纽约时报》称，普京21日早些时候发表国情咨文时称，俄罗斯暂停参与《新削减战略武器条约》。普京2月21日发表国情咨文的画面。图自俄新社据媒体此前报道，《新削减战略武器条约》由美俄两国2010年签署，2011年2月5日生效，有效期10年。美俄《中导条约》2019年失效后，这一条约成为两国间唯一军控条约。2021年2月3日，俄美双方互换外交照会，完成延长《新削减战略武器条约》有效期协议的相关内部程序，协议即日生效。《新削减战略武器条约》有效期延长至2026年2月5日，条约内容保持不变。俄罗斯外交部于2022年8月8日在其官网发表声明称，俄方已通过外交渠道通知美国，决定暂时退出《新削减战略武器条约》的设施核查机制，将相关俄设施从条约所规定的核查活动中撤出。俄外交部还称，俄方被迫采取这一措施，原因是“华盛顿一直希望在不考虑当前现实条件的情况下重启核查活动，为美国创造单边优势并剥夺俄罗斯在美国领土进行核查的权利”。番外普京刚发表完国情咨文谈俄乌局势后不久，乌方发声当地时间21日，俄罗斯总统普京发表国情咨文，谈及俄乌局势等话题。据法新社21日最新消息，就在普京这一讲话发表后不久，乌克兰总统办公室主任安德烈·叶尔马克同日晚些时候发声，称要把俄罗斯“赶出”乌克兰并予以惩罚。“他们在战略上走到了死胡同，”叶尔马克在社交平台Telegram上称，“我们的目的是把他们赶出乌克兰，并对他们做的一切进行惩罚。”乌克兰总统办公室主任安德烈·叶尔马克 资料图据此前报道，俄罗斯总统普京21日在莫斯科发表国情咨文，此次讲话正值俄乌冲突爆发一周年之际，因此备受国际社会关注。据俄新社等俄媒21日报道，谈及俄在乌特别军事行动，普京称，在战场上战胜俄罗斯是不可能的，特别军事行动是为了保卫俄罗斯和消除“纳粹威胁”。普京还表示，俄罗斯将逐步完成任务。,军事
46,中俄战略安全磋商机制双方牵头人举行会晤,原标题：中俄战略安全磋商机制双方牵头人举行会晤新华社莫斯科2月21日电（记者黄河）当地时间2023年2月21日，中共中央政治局委员、中央外事工作委员会办公室主任王毅在莫斯科同俄罗斯联邦安全会议秘书帕特鲁舍夫举行中俄战略安全磋商机制双方牵头人会晤。双方就当前国际战略形势进行了讨论，表示愿共同践行真正的多边主义，反对一切形式的单边霸凌行径，推动国际关系民主化和世界多极化。双方同意继续加强在多边框架内合作，为完善全球治理作出更多努力。双方认为应坚决维护亚太和平稳定，反对引入冷战思维、集团对抗和意识形态对立。双方还就乌克兰问题等交换了意见。,军事
47,马克龙：法国官方将继续推动退休制度改革,原标题：马克龙：法国官方将继续推动退休制度改革中新社巴黎2月21日电 （记者 李洋）法国总统马克龙当地时间21日在巴黎市郊与民众对话，明确法国官方将继续推动退休制度改革，他敦促人们接受更长的工作时间。这是该国上月宣布退休制度改革方案以来，马克龙首次就有关议题与民众进行面对面的直接对话，对话地点选在巴黎市郊的一个知名物流批发市场，该市场的不少工人据报为了工作早出晚归，加班加点。马克龙说，我们都知道必须将平均工作时间加长一些，旨在为国家创造更多财富；否则供给退休体制的资金便难以为继。根据退休制度改革方案，法国计划将法定退休年龄由62岁延迟至64岁。民调显示大部分民众反对延迟退休年龄。马克龙重申，延迟退休年龄是保障退休体制的方式。如果人们能够工作更长时间，便有机会使国家再度强盛，并使教育、健康等领域的资金供给成为可能。马克龙不认为退休制度改革“有其他可选项”。马克龙认为，接受退休制度改革应被视为“常识”。他呼吁在当前通货膨胀的“困难背景”下，应就有关改革议题展开真正意义上的社会辩论。他同时认为通货膨胀率可能在今年上半年“达到峰值”。马克龙此前只通过社交媒体就退休制度改革发表简单评论，或在出访期间简要回应相关问题。退休制度改革的大部分阐释工作由总理博尔内及劳工部长杜索普等人承担。退休制度改革的法律草案在国民议会（议会下院）的审议于上周末暂时结束，相关法律草案已送交参议院继续审议。法国主要工会定于3月7日组织新的大规模罢工和示威游行，反对退休制度改革。,军事
48,印度专家：西方保持沉默 破坏“北溪”真相不言自明,原标题：印度专家：西方保持沉默 破坏“北溪”真相不言自明据塔斯社当地时间20日报道，印度国际事务专家坎瓦尔·西巴尔就美国资深记者西摩·赫什爆料美国炸毁“北溪”管道一事发表评论称，欧洲各国政府，尤其是德国、法国、意大利和西班牙政府对此事的沉默很能说明问题。他指出，通常情况下，重要的能源设施遭受如此打击，西方会尽一切努力找出袭击者，而当下他们却一反常态，始终沉默，这让真相不言自明。他强调，作为一个北约成员国，如果美国承认炸毁了“北溪”管道，不仅会影响到欧洲和美国的舆论，还会在国际上产生严重后果。,军事
49,安倍侄子在竞选主页晒家谱图被批：除了家世还剩什么,原标题：安倍被侄子“利用”了安倍侄子在竞选主页晒家谱图被批，日网友：除了家世还剩什么？综合日本《朝日新闻》、《每日新闻》20日报道，安倍晋三的侄子、岸信夫的长子岸信千世日前开始了关于参加众议员补选的竞选活动。值得注意的是，岸信千世在自己竞选网站主页上直接贴出了家族谱系图，引发了日本在野党和舆论的抨击，认为岸信千世是在宣传“世袭”。目前，岸信千世承认已暂时关闭主页，但否认这与受到关于“世袭”的批评有关。前防卫大臣岸信夫宣布辞去众议院议员后，岸信夫长子岸信千世7日正式宣布，参加众议院山口2区补缺选举。据《每日新闻》报道，在其竞选网站主页上，岸信千世贴出了他的家族谱系图，上面的名字包括曾任日本首相的伯父安倍晋三、曾祖父岸信介和曾叔祖父佐藤荣作等人。《朝日新闻》报道称，岸信千世的做法引发了日本在野党和舆论的抨击。在网络上接连有人批评这是在标榜自己的“政治世家”。有人批评说，“这证明了其将政治当做家族财产”。还有人抨击，“看起来（岸信千世）将家谱图当做最大的卖点”。报道还称，目前该页面已经无法浏览，岸信千世20日受访时承认，已暂时关闭该主页。不过，岸信千世称，关闭主页是因为“发现主页本身存在故障”，与对家谱图的批评“完全没有关系”。对于贴出家谱图的理由，他称，“在家族中有很多人曾担任政治家，这是事实，家谱图是为了呈现这一事实。我了解到一些意见，包括关于家谱图的世袭批评等。将在今后认真考量主页内容”。不过，针对岸信千世的上述解释，仍有不少日本网友表示不满。有人称：“我们知道你的家族中有很多人曾担任政治家，但我们在只问你为什么‘特意贴出来’。不明白选民的疑问吗？”还有人质问道：“除了这些（家世）你还剩些什么？”有些日本网友表现出对“世袭”的不满。有人说道，“什么岸家安倍家，这是（日本武家封建时期的）将军家吗？”还有人说，“这就好比去面世，第一句话就向面试官标榜‘我是贵公司前社长的侄子，是公司家族的人’，太逊了”。,军事
50,法媒：乌克兰军队在切尔诺贝利核电站禁区训练,原标题：法媒：乌克兰军队在切尔诺贝利核电站禁区训练中新网2月21日电 据法新社当地时间20日报道，乌克兰军队正在切尔诺贝利核电站禁区进行训练。法新社在报道中描述了一辆装有高射炮的军用卡车在禁区内行驶，这一地区距离乌克兰和白俄罗斯的边境只有15公里。据称，乌军在当地进行攻击练习，许多参与训练的人员并非职业军人，他们在2022年乌克兰危机爆发后加入乌军。1986年4月26日，切尔诺贝利核电站4号机组反应堆爆炸，大量强放射性物质泄漏，酿成迄今为止世界上最严重的核泄漏事故。近840万人受到辐射，约35万人被迫离开被严重污染的家园。2022年2月俄开展对乌特别军事行动后，俄军曾短暂控制切尔诺贝利核电站。3月末，俄军将核电站的控制权移交乌方并离开该地区。,军事
51,外媒：乌克兰实际收到的财政援助不到西方承诺的一半,原标题：外媒：乌克兰实际收到的财政援助不到西方承诺的一半参考消息网2月21日报道 据俄罗斯卫星社2月21日报道，英国《金融时报》网站援引基尔世界经济研究所的分析结果称，乌克兰实际收到的财政援助不到西方国家和机构承诺的一半。消息称：“截至2022年12月，乌克兰财政部收到西方国家（自俄罗斯发起‘特别军事行动’以来）承诺的640亿欧元中的310亿欧元。”报道称，据基尔世界经济研究所计算，美国和欧盟机构“拖欠”大部分款项。《金融时报》援引泽连斯基的顾问米洛瓦诺夫的话称：“付款方面存在问题，不稳定，有延迟。”,军事
52,安理会同意了就北溪天然气管道被炸事件召开会议,原标题：安理会同意了俄罗斯常驻联合国副代表波利扬斯基2月15日在社交媒体上发文说，鉴于“北溪”天然气管道被炸事件出现新的细节，俄罗斯已向联合国安理会提出申请，要求在莫斯科时间2月22日23时（美国纽约时间22日15时）召开会议，讨论“北溪”天然气管道被炸事件。另据塔斯社15日报道，联合国大会将于纽约时间2月22日15时恢复召开有关乌克兰局势的特别会议，届时拟表决反俄决议。,军事
53,海南昌江：“华龙一号”核电3号机组内穹顶吊装成功,原标题：海南昌江：“华龙一号”核电3号机组内穹顶吊装成功2月21日上午，“十四五”时期全国首个开工的“华龙一号”机组——华能海南昌江核电二期工程3号机组内穹顶顺利吊装就位，标志着机组从土建施工阶段全面转入设备安装阶段，为深入推进建安一体化施工和高质量推进工程建设奠定了坚实基础。凌晨2时36分，随着风速测量符合标准，3200吨履带式吊车缓缓将总吊装重量518吨的外穹顶吊离地面，经过变幅、升钩、行走平移、调整等一系列高精度动作，历时3小时22分，穹顶精准地就位于堆顶结构之上。“华龙一号”是我国研发并有完全自主知识产权的第三代核电机组，土建阶段采用模块化的建造方式。钢衬里内穹顶是核岛反应堆厂房的重要屏障，是保证反应堆厂房完整性和密封性的重要组成部分，穹顶吊装因此成为核电站工程建设的重要里程碑节点。建设过程中，“华龙一号”建设项目团队加大技术创新，以海南高大挺拔的椰子树的形状为设计启发，自主设计创新首个建安一体化新型内穹顶拼装胎架，切实提高施工质量和本质安全。华能海南昌江核电二期项目是海南自贸港建设以来投资最大的能源项目，3号机组预计2026年初建成投入商业运营。投运后每年预估发电近100亿度，能够满足海南省100万人口的年度生产和生活用电需求，相当于每年减少二氧化碳排放816万吨。在海南昌江核电的建设现场，两个“华龙一号”核电机组与一个“玲龙一号”核电机组，形成了“一个厂址、两种堆型、三堆共建”的模式，这在我国核电建造史中是独一无二的，促进了海南创新和绿色发展，进一步助力“清洁能源岛”建设。（总台记者 陈龙 高军 张伟克 叶飞 王博丰）,军事
54,泽连斯基感谢意大利 称他正在乌克兰等待梅洛尼到来,原标题：泽连斯基：在乌克兰等她意媒：泽连斯基感谢意大利，称他“正在乌克兰等待梅洛尼到来”据意大利安莎社20日消息，意大利总理梅洛尼表示，她打算在即将到来的俄乌冲突一周年之前访问乌克兰。对此，乌克兰总统泽连斯基称，他会热烈欢迎梅洛尼访问乌克兰，并感谢意大利在俄乌冲突后对乌克兰的持续支持。报道称，泽连斯基还表示，尽管梅洛尼的盟友、意大利前总理、力量党领导人贝卢斯科尼发表了批评他的有争议的言论，但意大利对乌克兰的立场没有改变。“我们已经收到了（新的）一揽子援助，这意味着总理梅洛尼的支持没有改变，”泽连斯基对意大利国家电视台（RAI）说， “相反，我在这里感谢她，我在等待她。我知道，她（很快）就会来。我们非常尊重意大利和意大利人民。”路透社此前报道称，意大利前总理贝卢斯科尼本月12日表示，如果他仍然担任总理，不会寻求与泽连斯基会面、对话，因为他将俄乌冲突归咎于泽连斯基。他还敦促美国向泽连斯基施压，并威胁停止向乌克兰运送武器，同时还承诺如果乌克兰同意立即停火，将提供大规模援助计划。据媒体此前报道，意大利《新闻报》去年10月披露的录音显示，贝卢斯科尼近日告诉别人，自己生日时收到了来自俄总统普京的20瓶伏特加和一封“甜蜜信件”作为礼物，而他的回礼是葡萄酒和同样甜蜜的信件。在贝卢斯科尼“晒与普京互动言论录音”被曝光后，梅洛尼发表声明，宣称她的新政府将是一个“亲北约的政府”。来源：环球网/李诗睿,军事
55,南非驻华大使：已邀普京出席今年金砖国家领导人会晤,原标题：“已邀请普京出席”南非驻华大使谢胜文21日在接受《环球时报》记者采访时表示，南非已邀请俄罗斯总统普京出席今年8月在该国举行的金砖国家领导人非正式会晤。南非今年初从中国接过金砖国家轮值主席国一职，担任至2023年底。今年的金砖国家领导人非正式会晤也将在该国举行，但会晤地点尚未确定，可能在南非四大城市之一——约翰内斯堡、开普敦、德班或比勒陀利亚举行。近一年来，美国等国一直寻求在国际场合和外交上孤立俄罗斯。去年11月，普京未参加在印尼举行的二十国集团领导人峰会。有报道称，东道国印尼在宣布邀请普京出席峰会后，一度受到西方压力。谢胜文在采访中对《环球时报》记者表示，南非看不到任何阻止该国邀请金砖所有国家领导人参会的理由。今年的金砖国家领导人非正式会晤将是新冠疫情暴发三年来首次线下会晤，南非期待各国领导人能在此平台上真正认真地讨论正在发生的全球事务，包括使有关金砖扩员的讨论能够继续下去。谢胜文在21日在北京举行的“全球安全倡议：破解安全困境的中国方案”蓝厅论坛场边接受《环球时报》采访时作出上述表态。他表示，南非欢迎中国的提议，认为应通过对话而非对抗解决当下令人关切的全球和地区问题。“我们希望所有大国都能遵循（中国提出的）道路，确保不会利用自身经济实力和军事实力来胁迫其他国家。”这名南非外交官同时谈及西方对中国的打压。他表示，中国是全球事务中的重要角色，“如果孤立中国，或缺少中国的参与，就不会有持久的和平……中国在捍卫自己的安全利益，它不能被任何人欺凌。”,军事
