,col1,col2,col3
144,泽连斯基访欧索要战机：英法回应积极、德国保持谨慎,原标题：泽连斯基访欧再提战机需求：英法回应积极、德国保持谨慎当地时间2月8日，乌克兰总统泽连斯基出访英国，呼吁西方为乌军提供先进战斗机，此前英国方面已宣布将提供战斗机飞行员培训。泽连斯基随后还前往巴黎和布鲁塞尔先后会晤法、德以及欧盟领导人。据英国广播公司（BBC）2月9日报道，泽连斯基访英之际，乌英两国领导人会晤讨论“双管齐下的英国对乌援助”，其中包括立刻增加军火援助以应对俄军春季攻势，以及强化长期支持。此外，泽连斯基还在白金汉宫会见了英国国王查尔斯三世，并在英国议会下议院发表演讲。泽连斯基在英国议会讲话时继续呼吁伦敦提供先进战斗机，“自由会赢，我们知道俄罗斯会输。”他在威斯敏斯特大厅对一群英国议会议员以及官员说，英国与乌克兰会一起走向“我们一生中最重要的胜利”。《华尔街日报》报道称，在泽连斯基向英国议会发出“情感充沛的请求”、要求伦敦提供更多军事援助数小时后，有英国官员透露，该国首相苏纳克已责成国防大臣华莱士分析英国可能派遣哪些喷气式飞机。但该官员补充说，英国政府尚未做出最终决定，飞行员接受全面培训可能需要很长时间。伦敦方面还称，苏纳克向泽连斯基提议提议加强英国对乌克兰军人的培训力度，包括将培训范围扩大到战斗机飞行员，以确保乌克兰能够在未来有效保卫其领空，“这将让乌军飞行员能够在将来驾驶先进的北约标准战斗机。”不过，就在一星期前，苏纳克曾对外界表示，如果向乌克兰方面提供“台风”战斗机乃至F-35隐身战斗机，那么飞行员培训工作将至少需要几个月甚至几年时间，因此军援乌克兰还是以高效为宜。2月8日晚些时候，泽连斯基还从伦敦赶赴巴黎，与法国总统马克龙以及德国总理朔尔茨举行了会晤，法德领导人重申了他们的信念，即俄罗斯绝不能赢得这场冲突，他们将继续支持乌克兰。泽连斯基8日晚在与马克龙和朔尔茨举行的联合新闻发布会上再次呼吁称，法国和德国可以向乌克兰提供主战坦克、现代战斗机和远程导弹，以及可在与俄罗斯的战斗中“改变游戏规则” 的导弹。马克龙表示，乌克兰可以指望法国的支持，并且该国“决心帮助乌克兰取得胜利并重建其合法权利”。朔尔茨则未就提供战斗机以及更多武器做明确表态。BBC称，目前尚不清楚这是否意味着两国可能承诺向乌克兰提供战斗机。不久前， 德国媒体报道称，朔尔茨于1月29日重申德国不会向乌克兰提供战斗机。朔尔茨当时在接受《每日镜报》采访时说：“在武器系统方面，我的忠告是，不要陷入一种持续不断的竞购战中。”他称：“如果刚做了一个（关于提供主战坦克的）决定，德国又掀起另一轮（军援的）辩论，将给人一种态度轻忽的印象，而且会削弱民众对政府决策的信心。”至于马克龙，他此前的表态则更为积极，称不排除这一可能性。据美国“动力”军事新闻网站“战区”栏目报道，法国国民议会国防和武装部队委员会主席加西卢德1月27日表示，法国政府有可能同意向乌克兰提供战斗机。加西卢德在伦敦与包括英国国防大臣华莱士在内的同行会谈后说：“关于向乌克兰交付（战斗机），我们必须逐案研究请求，并敞开所有大门。”当地时间2月9日，泽连斯基拟前往布鲁塞尔与欧盟领导人会晤并在欧洲议会发表演讲。欧洲理事会主席米歇尔的一名发言人对外界披露，此前米歇尔曾经邀请泽连斯基“亲自参加一次欧盟峰会”。两名欧洲议会消息人士分别对法新社透露，泽连斯基很有可能在2月9日出席议会特别会议并发表演讲。乌克兰政府官员披露，泽连斯基将在布鲁塞尔要求加大军援力度。出于安全考量，欧盟以及乌克兰官方至今没有披露泽连斯基访问的具体行程。一星期前，多名欧盟领导人到访乌克兰，泽连斯基在会晤中再次呼吁加快吸纳乌克兰加入欧盟的进程。,军事
145,土耳其灾害应急管理局:7.7级地震后共发生1117次地震,原标题：土耳其灾害应急管理局：卡赫拉曼马拉什省地震后共发生1117次地震当地时间2月9日，据土耳其灾害应急管理局（AFAD）消息，在卡赫拉曼马拉什省发生7.7级地震之后，截至目前，土耳其共发生了1117次地震。（总台记者 赵兵）,军事
146,拜登国情咨文演讲前 第一夫人与第二先生却成了焦点,原标题：拜登国情咨文演讲前，第一夫人与第二先生的问候方式引争议（观察者网讯）当地时间2月7日，在美国总统拜登向国会发表国情咨文演讲前，第一夫人人吉尔·拜登和第二先生道格拉斯·埃姆霍夫（副总统哈里斯的丈夫）互相亲吻问候的画面被拍下，引发美国舆论热议。期间，美国保守派媒体纷纷下场，批评这一行为不妥。如福克斯新闻网称这一吻“令人尴尬”，《每日连线》编辑则质疑称两人用“嘴唇相贴”的吻问候“正常吗”，《纽约邮报》也称这一问候吻“怪异”，并补充称“总统妻子和副总统丈夫的亲吻似乎没有让附近的人感到不安”。当日晚上，美国民主党籍总统拜登在国会大厦众议院大厅发表上任以来第二次、也是共和党夺回众议院控制权后的第一次国情咨文演讲。在他演讲开始前，身着一条紫色连衣裙的第一夫人吉尔·拜登在欢呼声与掌声中走进众议院大厅。她一路和人交谈、握手，而当她走到第二先生道格拉斯·埃姆霍夫身前时，两人先是握手，然后身体向前倾，互相亲吻问候。这一幕被当时的直播清晰地记录下来，英国《每日邮报》在报道时描述称，两人在问候时嘴唇“似乎短暂地贴合在一起”。法新社则形容称，“他们倾身友好地拥抱——但至少其中一个人似乎弄错了，导致两人亲吻了嘴唇，或者非常、非常靠近嘴唇。”相较于外媒的谨慎措辞，美国多家保守派媒体在报道中纷纷指称吉尔·拜登与埃姆霍夫“嘴吻”了，并批评这一行为不妥。福克斯新闻网8日以“吉尔·拜登和道格拉斯·埃姆霍夫因在拜登的国情咨文中令人尴尬的接吻走红：这正常吗”为题，报道称埃姆霍夫“更热烈”地欢迎了第一夫人，“两人都被看见用亲吻对方嘴唇的方式问候对方”。《纽约邮报》8日也以“吉尔·拜登和道格·埃姆霍夫在国情咨文中怪异亲吻”为题，称两人“以嘴唇上的亲吻问候对方”，并补充称“总统妻子和副总统丈夫的亲吻似乎没有让附近的人感到不安”。保守派媒体人也开始议论纷纷，《每日连线》高级编辑卡伯特·菲利普斯（Cabot Phillips）就质疑称：“吉尔·拜登和道格·埃姆霍夫相互问候……用嘴唇相贴的吻？这……正常吗？”福克斯新闻撰稿人乔·孔查（Joe Concha）也表示：“亲脸颊就好。或者给一个拥抱。这个就很奇怪，因为他们都知道摄像头在拍他们。”美国知名保守派媒体人班尼·约翰逊（Benny Johnson）还一副被震惊到的模样：“吉尔·拜登刚才是不是亲了卡玛拉丈夫的嘴唇？！”之后，约翰逊还特意转发了他人放大两人亲吻场景的图片，以示吉尔·拜登和埃姆霍夫不是在亲脸颊……值得一提的是，吉尔·拜登和埃姆霍夫的问候吻除了被保守派人士抓住批评外，还在社交媒体上引起了轰动。截至目前，美国公共事务卫星有线电视网（C-SPAN）有关这一幕的直播视频在推特上已获得了超230万的点击量，许多人都在争论这一吻是否有问题。一方面，不少人表示，两人亲吻的场面令人不适。“什么鬼！太奇怪了！”“我要吐了。”但另一方面也有人不以为奇，并反驳称：“这是对家人或密友的老式正式问候。”“停止那些琐碎的胡扯。她只是在跟朋友打个招呼。那些觉得这个有问题的人才有问题。”有人还嘲讽保守派反应过度，“共和党正在集体心脏病发作，因为吉尔·拜登在道格·埃姆霍夫的嘴唇上匆匆轻吻了一下。”,军事
147,大炮坦克送完，该战机了？布林肯未明确排除可能性,原标题：大炮坦克送完，该战机了？美媒：布林肯未明确排除向乌提供战机可能，称将“持续作出判断”综合彭博社和美国有线电视新闻网（CNN）消息，美国国务卿布林肯当地时间8日在回答有关美方是否准备向乌克兰提供战机的问题时，并未明确排除将来提供此类援助的可能性。据彭博社报道，布林肯在华盛顿对记者说，“随着事态逐步发展，需求在变化，我们提供给乌克兰的（武器）也在变化。最近发生的（变化）是，（美国）决定提供‘艾布拉姆斯’坦克，当然德国也要提供‘豹’式坦克，其他欧洲国家也在做同样的事”。“重要的不仅仅是（提供）某种特定的武器系统、某种装备，”布林肯称，“乌克兰有能力有效使用（这些武器）同样重要，而在某些情况下，这需要大量训练。”报道称，布林肯进一步称，“这是一个不断发展的过程，关于我们认为乌克兰需要什么，我们认为在使用中最有效的是什么，我们将持续作出判断。”近期，在成功得到西方援助主战坦克后，乌克兰进一步寻求获得先进的西方战机。然而，多国在援乌战机问题上持谨慎态度。美国总统拜登1月30日否认美国将向乌克兰提供美制F-16型战机。法国、荷兰两国领导人同一天则表示，不排除向乌克兰提供战机的可能，但需警惕冲突进一步扩大的风险。1月31日，英国首相发言人表示，英方认为将英国战斗机提供给乌克兰是“不现实的”。,军事
148,白宫否认“美国摧毁北溪管道” 斯诺登连发多推回应,原标题：白宫否认“美国摧毁北溪管道”，斯诺登连发多推回应[文/观察者网 刘程辉]“美政府摧毁了北溪天然气管道”——美国资深调查记者西摩·赫什曝出的“猛料”引发巨大反响，美国白宫等部门密集否认相关指控。“棱镜门”曝光者、素有美国“吹哨人”之称的爱德华·斯诺登也就此作出回应。斯诺登转发了赫什的报道链接，并连发多条推文质疑美国方面的说法。他还引用美国第三任总统、《独立宣言》起草者杰斐逊的话暗示，美国政府“无法指望在国民无知的情况下拥有自由”。斯诺登2月9日在社交媒体推特上发文说：“在历史上，你们能想到白宫负责但坚决否认的秘密行动的例子吗？还有，你们都懂的，那个‘大规模监控’的乱子。”“今日俄罗斯”报道形容，斯诺登似乎并不相信白宫的否认。斯诺登9日发文，质疑白宫否认“摧毁北溪”的说法。推文中，斯诺登还附上了发表于1961年4月的一篇有关“猪湾事件”的新闻报道。在这篇报道中，时任美国国务卿的迪安·鲁斯克否认“猪湾事件”是“从美国领土发起的”，鲁斯克当时告诉记者，“古巴发生的事情属于古巴人自己解决的问题”，但美国对共产主义政权的敌人表示同情。实际上与鲁斯克的否认相反，“猪湾事件”正是由美国中央情报局（CIA）策划的。1961年4月17日凌晨，由CIA训练和武装、代号为2506突击旅的大约1500名雇佣军登陆古巴南部猪湾地区的吉隆滩和长滩，目的是推翻菲德尔·卡斯特罗和他领导的古巴政府。然而，行动在72小时内被古巴武装力量击溃，令美国颜面尽失。“今日俄罗斯”报道称，至于斯诺登提到的“大规模监控”，指的就是他所经历的“棱镜门”事件。由美国政府发起的大规模电子监听项目“棱镜计划”在2013年被曝光。事发后，美国政府以盗窃政府财产、向未经授权的人提供机密信息等罪名指控斯诺登，并吊销其护照，最终斯诺登经历近十年流亡生涯后入籍俄罗斯。值得一提的是，除斯诺登提到的两起事件外，一些网民还在评论区提到了“水门事件”“伊朗门”等美国历史上轰动一时的政治丑闻。“那可是一长串清单，比如新冠疫情、医疗保健、现代奴隶制，这些是我现在能想到的。”还有人写道，“我不相信白宫说的任何话，不过他们一旦否认，那就是另一回事了，往往后来它们都能100%得到证实。”此后，斯诺登又发表或转发了数条与“北溪事件”相关的推文。他转发了赫什的报告链接，并介绍赫什是一名“因揭露越南美莱大屠杀而获得普利策奖的记者，还曾报道过有关水门事件和阿布格莱布监狱事件”。这条推文中，斯诺登附上了“北溪”管道爆炸后，欧洲议会议员、波兰前外长西科尔斯基的推特截图。当时西科尔斯基曾发布了“北溪”管道发生事故的现场图，并配文称：“谢谢你，美国。”另一条推文则是美国负责政治事务的副国务卿纽兰的发言。在1月26日美国参议院外交事务委员会举行的一场听证会上，纽兰宣称得知“北溪”管道遭人为爆炸破坏后，“美国政府很开心”。“得知‘北溪-2’现在已成为海底一大块金属后，我很高兴，我相信（美国）政府也很高兴。”斯诺登还发文暗指美国政府说：“整个系统围绕这样一个想法，即只要经常大声重复，就可以让大多数人相信。而且这样做奏效了。”最新的一条推文，则是斯诺登转发的美国第三任总统、《独立宣言》起草者杰斐逊说过的一段话：如果一个国家期望在国民无知的情况下却拥有自由，那么这种期望无论在历史上，还是未来都绝不会实现。“北溪”天然气管道泄露事故距今已发生四月余，调查各方均认为管道遭“蓄意人为破坏”，但对于可能的幕后黑手，至今仍众说纷纭。美国资深调查记者、普利策奖得主西摩·赫什8日发布调查报告，指出此次泄露事故正是此前一直将矛头对向俄罗斯的美国政府所为。据赫什所说，去年6月，美国海军潜水员在一次军演的掩护下，在管道下埋设了爆炸装置，以完成美国总统拜登亲自发出的命令。对此，白宫、美国中情局等美政府机构则紧急否认。白宫国安委员会发言人沃森（Adrienne Watson）称调查报告“完全虚构”，CIA和国务院的发言人回应称，报告“完全是错误的”。针对赫什的报告，俄罗斯外交部发言人在社交媒体Telegram上写道，“所有人都要求我对这位美国记者的调查发表评论。我们一再表明俄罗斯对美国和北约（一次、二次、三次、四次、四次、五次、六次）参与这次袭击的立场。”“所有这些事实现在都应该由白宫给出交待。”扎哈罗娃说。,军事
149,埃尔多安承认救灾不力：但不可能为如此大灾做好准备,原标题：埃尔多安回应“救灾不力”：存在不足，但不可能为如此大灾做好准备（观察者网讯）土耳其本周突发连续强震致逾万人死伤，政府被批多年来对重灾防范不足，民众也对救援速度迟缓感到不满。据美联社9日报道，土耳其总统埃尔多安当地时间周三（8日）视察灾区时承认救灾工作存在“不足”。但他同时反驳了部分指责声音，称没有可能为如此级别的灾难做好准备。据悉，埃尔多安当天访问了重灾区哈塔伊省，这里有3300多人遇难，建筑和道路遭到严重破坏。地震还摧毁了哈塔伊机场的跑道，进一步影响了救灾活动。综合美联社、路透社和BBC报道，埃尔多安承认政府对地震的初步应对存在“不足”，承诺会加快处理重建工作，但表示现在情况已经“得到控制”。他还说，冬季天气也是影响救援的一个因素，相信未来的救灾工作“会更好”。此外，埃尔多安反驳了部分指责政府应对不力的批评。他表示，“没有可能为如此（级别）的灾难做好准备”，但政府不会让任何公民得不到照顾。他称，有“不光彩的人”正在散布关于政府行动的“谎言和诽谤”。报道称，埃尔多安还强调当前应该是一个“团结的时刻”，“在这种时期，我不能容忍有人因为政治利益进行负面宣传”。当地时间2月8日，土耳其卡赫拉曼马拉什，土耳其总统埃尔多安抵达土耳其灾害和应急管理局（AFAD）建立的“帐篷城”。图片来源：视觉中国截至当地时间2月8日，土耳其和叙利亚北部地区6日发生的大地震已造成超过1.5万人遇难。据土耳其阿纳多卢通讯社报道，地震后埃尔多安的专机也投入了救灾工作，并于8日晚从卡赫拉曼马什拉省将16名幸存婴儿运送到首都安卡拉。不过，美联社指出，有不少民众批评政府救灾不力，反映救援人员赶赴灾区速度很慢，错过最佳救援时间。据路透社9日报道，在哈塔伊省省会安塔基亚市一家医院外，64岁的梅莱克（Melek）对缺乏救援队表示遗憾。“我们从地震中幸存下来，但我们会因为饥饿或寒冷而死在这里。”在另一重灾区马拉蒂亚市，民众萨比哈·阿利纳克（Sabiha Alinak）也表示，自己的亲属已被困在倒塌的建筑下两天，尚未等到救援队伍。英国诺丁汉特伦特大学自然灾害专家史蒂文·戈德比（Steven Godby）对美联社指出，灾害发生后的72个小时至关重要，“（受困者或无法获得基本必需品的灾民）在24小时内的平均存活率为74%，72小时后为22%，到第五天则为6%”。报道还援引正在参与救援工作的前记者奥泽尔·皮卡尔（Ozel Pikal）的说法称，他认为至少有部分灾民在气温降至零下6摄氏度时被冻死了，“没有人从废墟中活着出来”。皮卡尔表示，马拉蒂亚市许多道路都处于关闭或破坏状态，救援车辆难以进入所有需要帮助的地区，低温天气也阻碍了救援进度。“由于寒冷，我们的手无法拿起任何东西，我们需要专业机械。”他说。法新社称，土耳其警方自此次地震发生以来已拘捕18人，理由是他们在社交媒体发布“煽动性”内容，或是批评埃尔多安政府处理灾情的方式。报道还援引网络监测组织Netblocks称，在土耳其的推特使用也受到限制。英国《金融时报》指出，土耳其这次“百年一遇”的大地震或进一步影响即将在5月中旬举行的总统及国会选举。灾难发生前，土耳其就面临着严重的通货膨胀、经济危机，执政近20年的埃尔多安声望有所下降。今年早些时候，该国六个反对派政党首次组成“六方圆桌”联盟，承诺要逆转埃尔多安的多项经济政策，收紧货币政策，并恢复央行的独立性。《金融时报》称，土耳其反对党已经“盯上了”这次地震以及政府有关应对措施，寻求机会向埃尔多安发难。最大反对党共和人民党（CHP）党魁凯末尔·科勒齐达奥卢表示：“如果有人要对此负主要责任，那就是埃尔多安。在过去20多年来，这个政府没有为国家的地震做好准备。”本文系观察者网独家稿件，未经授权，不得转载。,军事
150,美国财长耶伦称仍希望访华 与中国加强沟通非常重要,原标题：美财长：仍想访华，很重要外媒：美国财长耶伦称仍希望访华，与中国加强沟通非常重要据路透社报道，美国财政部长耶伦当地时间周三（8日）表示，自己仍希望访问中国，但没有透露具体时间。路透社上月报道称，两名消息人士曾告诉该媒体，美国财政部官员代表团计划在今年2月访问中国，为美国财政部长耶伦随后访华做准备。不过，路透社最新报道声称，该计划是在美国宣称发现“中国气球”之前，该事件也促使美国国务卿布林肯取消了原定于上周展开的访华行程。路透社最新报道称，耶伦8日对记者表示，加强与中国在经济领域上的沟通交流非常重要。“我仍然希望能够访问中国，与经济领域的同行会面。但我没有任何具体的时间告诉你，我确实认为这取决于国务院和国防部（的决定），”她说。上月18日，瑞士苏黎世，耶伦与中国国务院副总理、中美全面经济对话中方牵头人刘鹤举行会谈上周，中国民用无人飞艇误入美国领空，美方将此事炒作为“间谍活动”，并动用武力击落无人飞艇，这给亟待缓和的中美关系再添阴影。本月6日，多家美国媒体持续炒作此事，一些美国政客和媒体借题发挥，称击落的中国飞艇“用于监视”，有意鼓噪“中国对美国本土构成安全威胁”。6日外交部记者会上，发言人毛宁就中国飞艇误入事件表示，这次事件完全是不可抗力导致的意外。美国国防部也发表声明，这个气球，或者说飞艇，不会对地面人员构成军事和人身威胁。美方不顾中方的反复说明，执意动用武力明显反应过度，中方坚决反对。关于如今的中美关系，中国外交部发言人毛宁表示，中方始终按照习近平主席提出的相互尊重、和平共处、合作共赢三原则看待和发展中美关系，同时坚定捍卫自身主权安全发展利益。此次飞艇误入美国领空完全是个意外偶发事件，但考验的是美方对稳定和改善中美关系的诚意以及处理危机的方式。美方应同中方相向而行，妥善管控分歧，避免误解误判、破坏彼此互信。,军事
151,朝鲜举行阅兵纪念人民军建军75周年 展示多型新武器,原标题：朝鲜，昨晚阅兵！朝鲜阅兵现场画面公开当地时间2月8日晚间，朝鲜举行阅兵纪念人民军建军75周年。阅兵式展示了多种新型武器，战术导弹方阵、远程巡航导弹方阵、战术核运用部队方阵等亮相。,军事
152,现场视频！中国救援队从废墟中救出一名孕妇,原标题：现场视频！中国救援队从废墟中救出一名孕妇2月6日以来，土耳其连续发生强烈地震，造成重大人员伤亡和财产损失。据土耳其和叙利亚政府及救援方面8日最新消息，土耳其南部靠近叙利亚边境地区的强震已致两国超过11000人遇难。在救援的过程中，不断发生的奇迹让我们感受到生命的顽强。当地时间9日1时30分，中国救援队与当地救援队通力合作，从一栋8层倒塌房屋废墟中成功营救出一名孕妇，这是中国救援队成功参与营救的首位幸存者。目前，除了已抵达土耳其的中国救援队，蓝天救援系统、深圳公益救援队等10支社会应急力量也赴一线参与救援。一笔直铁轨因强震几乎弯成90度总台记者在震中卡赫拉曼马拉什省看到，有双向道路被损毁变窄，一条笔直的铁轨在强震作用下，几乎弯曲成90度。地震灾区已发生790次余震 逾10万人参与救援当地时间2月8日晚，土耳其副总统奥克塔伊表示，截至目前，地震灾区已经发生了790次余震。奥克塔伊表示，在救灾现场，有来自66个国家的搜救队，超过900台起重机，临时住宿区内人数已超过50万人。政府已经向受灾省份分发了大约10万顶帐篷，包括来自救灾部门、安全部队、红新月会、非政府组织、志愿者、卫生队等在内的救援人员总数为103800人，已搭建完成能容纳106万人的庇护所，目前物流运输方面运转正常，政府没有封闭道路。[原标题]现场视频！中国救援队从废墟中救出一名孕妇→来源 | 央视新闻微信公众号,军事
